{"$schema":"./nautilus-sandbox-comparison-v1.schema.json","authority":"READ_ONLY_EVIDENCE_ADAPTER","classification":"SUPPLY_CHAIN_EVIDENCE_INCOMPLETE","comparison_hash":"68ada470ba377f81a1ba4074405285a584cab5dbd34c28c99b182c590649f2d5","comparison_id":"nautilus_sandbox_comparison_cbee55507b916d0dac64ad166af1e7d7ebad9f532ca4cbe9eebcaa8d5e4c3c32","conclusion":"INCONCLUSIVE_BLOCKED","current_core_effect":"NONE_KEEP_CURRENT_CORE","dependency_lock_hash":"eea3232a6494dad9500d8391234193222bc97a6992ba183c347e3a0f883e022d","dependency_lock_id":"nautilus_sandbox_dependency_lock_068d138779fecabfb37fdfb0823e2025a532c835c2be01f413f8069284e2da09","gates":{"compatibility_request_frozen":false,"exact_dependency_metadata":true,"fresh_process_replay_verified":false,"future_shadow_eligible":false,"golden_scenarios_executed":false,"license_bytes_locally_verified":false,"runtime_failure_suite_executed":false,"sandbox_result_available":false,"static_blocked_path_tests_executed":true,"wheel_locally_verified":false},"reason_codes":["SUPPLY_CHAIN_FETCH_NOT_MACHINE_REPLAYABLE"],"schema_version":"1.0.0","status":"ADOPTION_REPORT_INCONCLUSIVE_NO_RETRY_V0_63","supply_chain_fetch_attestation":{"attempt_count":2,"attempts":[{"attempt":1,"observed_exit_code":1,"observed_outcome":"UV_RETRIES_EXHAUSTED_TIMEOUT","policy":"UV_FROZEN_DEFAULT_RETRY_POLICY"},{"attempt":2,"observed_exit_code":130,"observed_outcome":"BOUNDED_RECOVERY_ABORTED_NO_PROGRESS","policy":"UV_FROZEN_SAME_SOURCE_EXTENDED_READ_TIMEOUT"}],"attestation_hash":"1fdcc8c0d8161e163dcac88e6ce4635b8e6c54944ec7fc002d216833463bdc70","attestation_id":"nautilus_supply_chain_fetch_attestation_82c54303387032f87973d234f35cce3b7e94fb67e450012066c3a3bda5b62027","broker_request_count":0,"credential_access_count":0,"exact_transcript_bytes_available":false,"external_attestation_available":false,"hash_relaxation_count":0,"locked_package":"nautilus_trader==1.227.0","machine_replayable":false,"market_request_count":0,"observed_python":"CPython 3.12.13","observed_tool":"uv 0.11.7","official_source":"https://files.pythonhosted.org","production_state_write_count":0,"real_order_count":0,"reason_code":"SUPPLY_CHAIN_FETCH_NOT_MACHINE_REPLAYABLE","result_published":false,"retry_allowed_within_v0_63":false,"sandbox_engine_creation_count":0,"sandbox_runner_invocation_count":0,"source_change_count":0,"status":"SESSION_ATTESTATION_NOT_MACHINE_REPLAYABLE","version_change_count":0}}
